{"capture_revision_id":"81e4985b-3169-49a4-b76c-8316a7145117","flags":[{"cameraForwardWorld":{"x":0,"y":0,"z":-1},"cameraPositionWorld":{"x":0,"y":1.5,"z":0},"captureSessionID":"0f936474-e29d-415d-9691-b52faed6227b","category":"geometry","coordinateSpaceID":"893addc6-b4b6-4cb4-8da2-67c64765ffa5","coverageCell":"2,3","createdSessionTimestampSeconds":21,"flagID":"6ff68f42-969b-4271-827c-3dc426d33c79","note":"Dark corner","status":"unresolved","targetFromRaycast":true,"targetPointWorld":{"x":1,"y":1,"z":1}}],"schema":"htdt.capture.revisit_flags","schema_version":"1.0.0"}